{
  "generated_at": "2000-01-01T00:00:00Z",
  "generator": {
    "name": "synth-dicom-gen",
    "rustc": "rustc 1.85.0 (4d91de4e4 2025-02-17)",
    "target": "aarch64-apple-darwin",
    "version": "0.2.0"
  },
  "instances": [
    {
      "bulk": [
        {
          "address": {
            "element": 16,
            "group": 32736
          },
          "kind": "integer_pixel_data",
          "placement": {
            "kind": "top_level"
          },
          "properties": {
            "bits_allocated": "8",
            "columns": "2",
            "frames": "1",
            "iod_conformance": "not_assessed",
            "padding": "none",
            "resolved_sha256": "054edec1d0211f624fed0cbca9d4f9400b0e491c43742af2c5b0abebf0c990d8",
            "rows": "2",
            "samples_per_pixel": "1",
            "source_kind": "inline_base64",
            "source_sha256": "054edec1d0211f624fed0cbca9d4f9400b0e491c43742af2c5b0abebf0c990d8"
          },
          "sha256": "054edec1d0211f624fed0cbca9d4f9400b0e491c43742af2c5b0abebf0c990d8",
          "size_bytes": 4,
          "slot": "bulk_0",
          "vr": "OB"
        }
      ],
      "elements": [
        {
          "address": {
            "element": 16,
            "group": 16
          },
          "origin": "instance_override",
          "value": {
            "kind": "primitive",
            "value": {
              "kind": "string",
              "value": "SYNTHETIC^ASSEMBLY"
            }
          },
          "vr": "PN"
        },
        {
          "address": {
            "element": 4112,
            "group": 17,
            "private_creator": "DTS_ASSEMBLY"
          },
          "origin": "instance_override",
          "value": {
            "kind": "primitive",
            "value": {
              "kind": "string",
              "value": "STRUCTURAL"
            }
          },
          "vr": "LO"
        },
        {
          "address": {
            "element": 13,
            "group": 32
          },
          "origin": "derived_structural",
          "value": {
            "kind": "primitive",
            "value": {
              "kind": "string",
              "value": "2.25.131391886742213678286033606434638135815"
            }
          },
          "vr": "UI"
        },
        {
          "address": {
            "element": 14,
            "group": 32
          },
          "origin": "derived_structural",
          "value": {
            "kind": "primitive",
            "value": {
              "kind": "string",
              "value": "2.25.39607469728402369607566362072293772613"
            }
          },
          "vr": "UI"
        },
        {
          "address": {
            "element": 82,
            "group": 32
          },
          "origin": "derived_structural",
          "value": {
            "kind": "primitive",
            "value": {
              "kind": "string",
              "value": "2.25.245763833390795330413760970236265638444"
            }
          },
          "vr": "UI"
        },
        {
          "address": {
            "element": 96,
            "group": 8
          },
          "origin": "derived_structural",
          "value": {
            "kind": "primitive",
            "value": {
              "kind": "string",
              "value": "OT"
            }
          },
          "vr": "CS"
        },
        {
          "address": {
            "element": 16,
            "group": 40
          },
          "origin": "derived_structural",
          "value": {
            "kind": "primitive",
            "value": {
              "kind": "unsigned",
              "value": 2
            }
          },
          "vr": "US"
        },
        {
          "address": {
            "element": 17,
            "group": 40
          },
          "origin": "derived_structural",
          "value": {
            "kind": "primitive",
            "value": {
              "kind": "unsigned",
              "value": 2
            }
          },
          "vr": "US"
        },
        {
          "address": {
            "element": 8,
            "group": 40
          },
          "origin": "derived_structural",
          "value": {
            "kind": "primitive",
            "value": {
              "kind": "unsigned",
              "value": 1
            }
          },
          "vr": "US"
        },
        {
          "address": {
            "element": 2,
            "group": 40
          },
          "origin": "derived_structural",
          "value": {
            "kind": "primitive",
            "value": {
              "kind": "unsigned",
              "value": 1
            }
          },
          "vr": "US"
        },
        {
          "address": {
            "element": 256,
            "group": 40
          },
          "origin": "derived_structural",
          "value": {
            "kind": "primitive",
            "value": {
              "kind": "unsigned",
              "value": 8
            }
          },
          "vr": "US"
        },
        {
          "address": {
            "element": 257,
            "group": 40
          },
          "origin": "derived_structural",
          "value": {
            "kind": "primitive",
            "value": {
              "kind": "unsigned",
              "value": 8
            }
          },
          "vr": "US"
        },
        {
          "address": {
            "element": 258,
            "group": 40
          },
          "origin": "derived_structural",
          "value": {
            "kind": "primitive",
            "value": {
              "kind": "unsigned",
              "value": 7
            }
          },
          "vr": "US"
        },
        {
          "address": {
            "element": 259,
            "group": 40
          },
          "origin": "derived_structural",
          "value": {
            "kind": "primitive",
            "value": {
              "kind": "unsigned",
              "value": 0
            }
          },
          "vr": "US"
        },
        {
          "address": {
            "element": 4,
            "group": 40
          },
          "origin": "derived_structural",
          "value": {
            "kind": "primitive",
            "value": {
              "kind": "string",
              "value": "MONOCHROME2"
            }
          },
          "vr": "CS"
        }
      ],
      "identity": {
        "frame_of_reference_uid": "2.25.245763833390795330413760970236265638444",
        "provenance": {
          "frame_of_reference": "deterministic",
          "series": "deterministic",
          "sop": "deterministic",
          "study": "deterministic"
        },
        "series_instance_uid": "2.25.39607469728402369607566362072293772613",
        "sop_instance_uid": "2.25.46553092604571578884474658719670022502",
        "study_instance_uid": "2.25.131391886742213678286033606434638135815"
      },
      "instance_id": "primary",
      "iod_conformance": "not_assessed",
      "output_path": "instances/primary.dcm",
      "references": [],
      "resolved_plan_sha256": "b7505f0aa740d280f4be80041aa8d7b15830ea931954bd870ff24658c14c05e9",
      "sha256": "7da898187a4f13054d48268660770f86c6939c082a5731d8f3737a5a855c7ba7",
      "size_bytes": 774,
      "sop_class_uid": "1.2.840.10008.5.1.4.1.1.7",
      "sop_instance_uid": "2.25.46553092604571578884474658719670022502",
      "transfer_syntax_uid": "1.2.840.10008.1.2.1",
      "validation": [
        {
          "details": {
            "checks": [
              {
                "layer": "part10",
                "message": "128-byte preamble and DICM prefix are present",
                "rule_id": "preamble_and_prefix",
                "status": "passed"
              },
              {
                "layer": "part10",
                "message": "generated file reopens as a DICOM Part 10 object",
                "rule_id": "reopen",
                "status": "passed"
              },
              {
                "layer": "part10",
                "message": "file meta SOP and transfer-syntax identities match the resolved plan",
                "rule_id": "meta_identity",
                "status": "passed"
              },
              {
                "layer": "generic_data_elements",
                "message": "15 resolved attributes reopened with their planned VRs",
                "rule_id": "resolved_attributes",
                "status": "passed"
              },
              {
                "layer": "content",
                "message": "1 content slots match planned VR, size, and SHA-256",
                "rule_id": "content_integrity",
                "status": "passed"
              },
              {
                "layer": "template",
                "message": "0 materialized references are closed and source-consistent",
                "rule_id": "reference_projection",
                "status": "passed"
              }
            ]
          },
          "layer": "generic",
          "message": "composition validation `structural_round_trip` passed",
          "required": true,
          "rule_id": "structural_round_trip",
          "status": "passed"
        }
      ]
    }
  ],
  "manifest_schema_version": "1.0.0",
  "product_resources": {
    "origin": "embedded",
    "resource_count": 240,
    "resource_set_sha256": "dc61cc012f983297fef864f68e6cd172a9d33ac9ad4faab4cc66d3526b688410",
    "resource_set_version": "1.0.0",
    "resources": [
      {
        "logical_path": "Cargo.lock",
        "sha256": "4aa4b6c94043fb2f236ec888ac9b253f2ff451b666464609f81f82aaac6d8a4d",
        "size_bytes": 41997
      },
      {
        "logical_path": "assets/dcmtk_srgb_input_profile.hex",
        "sha256": "249dd54ff7fc219611e1f8ed459dbf9632ac9974753b7ebc7feea6e917804e84",
        "size_bytes": 1473
      },
      {
        "logical_path": "cases/recipes/classic/cr/cr_overlay_modality_voi.json",